{
  "$schema": "https://json-schema.org/draft/2020-12/schema",
  "title": "Private Marketing Profile",
  "description": "Binds the public marketing roles to a private company's channels, platforms, budget envelopes, content, policies, and connectors.",
  "type": "object",
  "additionalProperties": false,
  "required": ["version", "roles", "channels", "budget_envelopes", "content_refs", "policy_refs", "capability_bindings"],
  "properties": {
    "version": {"type": "integer", "const": 1},
    "roles": {
      "type": "object",
      "additionalProperties": false,
      "required": ["brand_manager", "direct_email", "paid_media", "social_media", "content_reviewer"],
      "properties": {
        "brand_manager": {"$ref": "role-capability-policy.schema.json"},
        "direct_email": {"$ref": "role-capability-policy.schema.json"},
        "paid_media": {"$ref": "role-capability-policy.schema.json"},
        "social_media": {"$ref": "role-capability-policy.schema.json"},
        "content_reviewer": {"$ref": "role-capability-policy.schema.json"}
      }
    },
    "channels": {
      "type": "array",
      "minItems": 1,
      "items": {
        "type": "object",
        "additionalProperties": false,
        "required": ["id", "platform", "kind", "system_ref", "owner_role"],
        "properties": {
          "id": {"type": "string", "pattern": "^[a-z0-9][a-z0-9._-]*$"},
          "platform": {"enum": ["facebook-pages", "instagram", "threads", "tiktok", "linkedin", "x", "youtube", "pinterest", "meta-ads", "google-ads", "microsoft-ads", "tiktok-ads", "linkedin-ads", "email-esp", "sms", "other"]},
          "kind": {"enum": ["social-owned", "paid-media", "email", "messaging"]},
          "system_ref": {"type": "string", "pattern": "^system://[a-z0-9][a-z0-9._-]*$"},
          "owner_role": {"enum": ["direct_email", "paid_media", "social_media"]},
          "account_ref": {"type": "string", "pattern": "^(config|secret)://[A-Za-z0-9._/-]+$"},
          "preapproved_content_classes": {"type": "array", "uniqueItems": true, "items": {"type": "string", "minLength": 1}},
          "publish_window_ref": {"type": "string"}
        }
      }
    },
    "budget_envelopes": {
      "type": "array",
      "items": {
        "type": "object",
        "additionalProperties": false,
        "required": ["id", "owner_department", "currency", "period", "amount_minor", "channels"],
        "properties": {
          "id": {"type": "string", "pattern": "^[a-z0-9][a-z0-9._-]*$"},
          "owner_department": {"const": "finance"},
          "currency": {"type": "string", "pattern": "^[A-Z]{3}$"},
          "period": {"enum": ["daily", "weekly", "monthly", "campaign"]},
          "amount_minor": {"type": "integer"},
          "daily_cap_minor": {"type": "integer"},
          "single_action_cap_minor": {"type": "integer"},
          "channels": {"type": "array", "minItems": 1, "uniqueItems": true, "items": {"type": "string"}},
          "approval_ref": {"type": "string"}
        }
      }
    },
    "content_refs": {
      "type": "object",
      "additionalProperties": false,
      "required": ["brand_guideline", "claims_register"],
      "properties": {
        "brand_guideline": {"type": "string", "minLength": 1},
        "claims_register": {"type": "string", "minLength": 1},
        "content_calendar": {"type": "string"},
        "review_rubric": {"type": "string"},
        "templates": {"type": "array", "items": {"type": "string"}}
      }
    },
    "policy_refs": {
      "type": "object",
      "additionalProperties": false,
      "required": ["consent", "targeting", "platform_policy", "escalation"],
      "properties": {
        "consent": {"type": "string", "minLength": 1},
        "targeting": {"type": "string", "minLength": 1},
        "platform_policy": {"type": "string", "minLength": 1},
        "escalation": {"type": "string", "minLength": 1},
        "crisis_window": {"type": "string"},
        "measurement": {"type": "string"},
        "ugc_consent": {"type": "string"}
      }
    },
    "capability_bindings": {"type": "array", "items": {"$ref": "capability-binding.schema.json"}},
    "sampling_policy_ref": {"type": "string"},
    "model_assignment_refs": {"type": "array", "items": {"type": "string"}}
  }
}
